{
  "surface_id": "AOA-K-0007",
  "source_refs": [
    "Tree-of-Sophia/docs/NODE_CONTRACT.md",
    "Tree-of-Sophia/docs/PRACTICE_BRANCH.md"
  ],
  "lineage_refs": [
    "predecessor",
    "mutation",
    "commentary-on"
  ],
  "conflict_refs": [
    "interpretation-ladder-boundary"
  ],
  "practice_refs": [
    "practice-branch",
    "improvement-log"
  ],
  "axis_summary": "Returns bounded source, lineage, conflict, and practice handles so AoA can retrieve context without treating the derived surface as authored truth."
}
